filename,location,pages,mentions,source,location_type
2011_Woolfe_The stratigraphy and metamorphic facies of the KEMB.txt,"0805000 E, 1594000 N",6,"The  field  area,  which  is  approximately  30km2,  hosts  two  east-west  trending  ridges  that 
expose a portion of the KEMB  (Fig. 1.1b). The  UTM coordinates of the extent of the field 
area  are:    30  P  (Northern  Hemisphere)  0805000  E,  1600000  N;  0805000  E,  1594000  N; 
0810000 E, 1594000 N; 0810000 E, 1600000 N. This region of Burkina Faso is situated in 
the Sahel, just south of the Sahara Desert. Climatic conditions are arid, that is very hot and 
dry. Field  work  was  carried  out  in  January  which  is  the  coolest  time  of  the  year  although 
daily  temperatures  exceeded  30  ⁰C.",llm,APPROXIMATE
2011_Woolfe_The stratigraphy and metamorphic facies of the KEMB.txt,"0810000 E, 1594000 N",6,"The  field  area,  which  is  approximately  30km2,  hosts  two  east-west  trending  ridges  that 
expose a portion of the KEMB  (Fig. 1.1b). The  UTM coordinates of the extent of the field 
area  are:    30  P  (Northern  Hemisphere)  0805000  E,  1600000  N;  0805000  E,  1594000  N; 
0810000 E, 1594000 N; 0810000 E, 1600000 N. This region of Burkina Faso is situated in 
the Sahel, just south of the Sahara Desert. Climatic conditions are arid, that is very hot and 
dry. Field  work  was  carried  out  in  January  which  is  the  coolest  time  of  the  year  although 
daily  temperatures  exceeded  30  ⁰C.",llm,APPROXIMATE
2011_Woolfe_The stratigraphy and metamorphic facies of the KEMB.txt,"0810000 E, 1600000 N",6,"The  field  area,  which  is  approximately  30km2,  hosts  two  east-west  trending  ridges  that 
expose a portion of the KEMB  (Fig. 1.1b). The  UTM coordinates of the extent of the field 
area  are:    30  P  (Northern  Hemisphere)  0805000  E,  1600000  N;  0805000  E,  1594000  N; 
0810000 E, 1594000 N; 0810000 E, 1600000 N. This region of Burkina Faso is situated in 
the Sahel, just south of the Sahara Desert. Climatic conditions are arid, that is very hot and 
dry. Field  work  was  carried  out  in  January  which  is  the  coolest  time  of  the  year  although 
daily  temperatures  exceeded  30  ⁰C.",llm,APPROXIMATE
2011_Woolfe_The stratigraphy and metamorphic facies of the KEMB.txt,20km ESE of the field,4,"The  Essakane  gold  mine  and  Tambão  manganese  deposit  are  situated  approximately 
20km ESE and 40km NNE of the field area, respectively, and similar styles of mineralisation 
may occur in the field area. 1.2 Location and physiography 
The KEMB is located in the northeast of Burkina Faso, approximately 275km to the northeast 
of Ouagadougou and east of the town of Gorom Gorom (Fig. 1.1a & 1.1b). 3",llm,PLACE
2011_Woolfe_The stratigraphy and metamorphic facies of the KEMB.txt,275km to the northeast of Ouagadougou,4,"The  Essakane  gold  mine  and  Tambão  manganese  deposit  are  situated  approximately 
20km ESE and 40km NNE of the field area, respectively, and similar styles of mineralisation 
may occur in the field area. 1.2 Location and physiography 
The KEMB is located in the northeast of Burkina Faso, approximately 275km to the northeast 
of Ouagadougou and east of the town of Gorom Gorom (Fig. 1.1a & 1.1b). 3",llm,PLACE
2011_Woolfe_The stratigraphy and metamorphic facies of the KEMB.txt,"30 P 0805000 E, 1600000 N",6,"The  field  area,  which  is  approximately  30km2,  hosts  two  east-west  trending  ridges  that 
expose a portion of the KEMB  (Fig. 1.1b). The  UTM coordinates of the extent of the field 
area  are:    30  P  (Northern  Hemisphere)  0805000  E,  1600000  N;  0805000  E,  1594000  N; 
0810000 E, 1594000 N; 0810000 E, 1600000 N. This region of Burkina Faso is situated in 
the Sahel, just south of the Sahara Desert. Climatic conditions are arid, that is very hot and 
dry. Field  work  was  carried  out  in  January  which  is  the  coolest  time  of  the  year  although 
daily  temperatures  exceeded  30  ⁰C.",llm,APPROXIMATE
2011_Woolfe_The stratigraphy and metamorphic facies of the KEMB.txt,40km NNE of the field,4,"The  Essakane  gold  mine  and  Tambão  manganese  deposit  are  situated  approximately 
20km ESE and 40km NNE of the field area, respectively, and similar styles of mineralisation 
may occur in the field area. 1.2 Location and physiography 
The KEMB is located in the northeast of Burkina Faso, approximately 275km to the northeast 
of Ouagadougou and east of the town of Gorom Gorom (Fig. 1.1a & 1.1b). 3",llm,PLACE
2011_Woolfe_The stratigraphy and metamorphic facies of the KEMB.txt,Ashworth,47,"Another process by which a migmatite can form is during metasomatism (Sawyer, 2008). The 
presence of fluids is known to act as a flux and thus can reduce the melting temperature (Fig. 7.4) by changing the solidus (Ashworth, 1985;Sawyer, 2008; Vernon and Clarke, 2008). Fluid interaction, to induce melting, can take place in two ways: 
1. Metasomatism  before  melting  (Sawyer,  2008). The  infiltration  of  metasomatic 
fluids  from  an  outside  source  involves  the  enrichment  of  the  rock  by  improving 
the  rock  fertility  (Vernon  and  Clarke,  2008)  thus  making  it  more  susceptible  to 
melting.",rules,PLACE
2011_Woolfe_The stratigraphy and metamorphic facies of the KEMB.txt,Banding,30,"5.1 Unit descriptions 
Amphibolite 
Amphibolite  samples  consist  of  fine-grained  and  equigranular  minerals  up  to  0.3  mm  (Fig. 5.1). The  amphibolite  is  dominated  by  quartz  and  hornblende,  with  plagioclase  in  low 
concentrations. Mineral  proportions  of  the  whole  rock  are  approximately  hornblende:  54%; 
quartz: 40% and plagioclase 6%. The amphibolite is host to a compositional banding texture 
which is exhibited by the presence of compositional banding. Banding comprises hornblende- 
and quartz-rich bands.",rules,PLACE
2011_Woolfe_The stratigraphy and metamorphic facies of the KEMB.txt,Beauvais,9,"Specifically  the  Oudalan-Gorouol  Greenstone  Belt  has  undergone  greenschist-
facies  metamorphism  (Tshibubudze  et  al.,  2009). Regional  metamorphism  to  greenschist 
facies is associated to north-south crustal shortening during the Eburnean Orogeny (Vidal et 
al., 1996, Beziat et al., 2000, Hein et al., 2004 and Naba et al., 2004). Contact metamorphism 
of  these  rocks  occurred  due  to  the  emplacement  of  granitoids  which  include  granite-
adamellite,  granite  and  granodiorite  compositions  (Pons  et  al.,  1995;  Debat  et  al.,  2003; 
Tshibubudze et al., 2009). Metamorphism of the surrounding units to the granitoids occurred 
to  amphibolite-facies  (Pons  et  al.,  1995;  Tshibubudze  et  al.,  2009;  Tshibubudze  and  Hein, 
submitted)  and  granulite  facies  (Tshibubudze  and  Hein,  submitted).. Through  hornblende 
barometric estimates, shallow crust (3-4 kbar) emplacement of plutons has been established 
(Pons et al., 1992). Gold and manganese mineralisation as well as pegamatite veins are present in the Oudalan-
Gorouol  greenstone  belt  (Milési  et  al.,  1992;  Nikiéma,  1992;  Beauvais  et  al.,  2008 
Tshibubudze, et al., 2009; Tshibubudze and Hein, submitted).",rules,PLACE
2011_Woolfe_The stratigraphy and metamorphic facies of the KEMB.txt,Beziat,9,"Specifically  the  Oudalan-Gorouol  Greenstone  Belt  has  undergone  greenschist-
facies  metamorphism  (Tshibubudze  et  al.,  2009). Regional  metamorphism  to  greenschist 
facies is associated to north-south crustal shortening during the Eburnean Orogeny (Vidal et 
al., 1996, Beziat et al., 2000, Hein et al., 2004 and Naba et al., 2004). Contact metamorphism 
of  these  rocks  occurred  due  to  the  emplacement  of  granitoids  which  include  granite-
adamellite,  granite  and  granodiorite  compositions  (Pons  et  al.,  1995;  Debat  et  al.,  2003; 
Tshibubudze et al., 2009). Metamorphism of the surrounding units to the granitoids occurred 
to  amphibolite-facies  (Pons  et  al.,  1995;  Tshibubudze  et  al.,  2009;  Tshibubudze  and  Hein, 
submitted)  and  granulite  facies  (Tshibubudze  and  Hein,  submitted).. Through  hornblende 
barometric estimates, shallow crust (3-4 kbar) emplacement of plutons has been established 
(Pons et al., 1992). Gold and manganese mineralisation as well as pegamatite veins are present in the Oudalan-
Gorouol  greenstone  belt  (Milési  et  al.,  1992;  Nikiéma,  1992;  Beauvais  et  al.,  2008 
Tshibubudze, et al., 2009; Tshibubudze and Hein, submitted).",rules,PLACE
2011_Woolfe_The stratigraphy and metamorphic facies of the KEMB.txt,Billiata,9,"Gold mineralisation, found at 
many locations, is hosted in shear zones as structural hosted lode-gold associated with NW-
SE structures (Nikiéma, 1992; Tshibubudze et al., 2009; Tshibubudze and Hein, submitted). Manganese  mineralisation  is  situated  NE  and  SW  of  the  KEMB  at  Tambăo  and  Billiata 
(Tshibubudze and Hein, submitted) and pegamatite veins are situated NE at Tambăo. 8",llm,PLACE
2011_Woolfe_The stratigraphy and metamorphic facies of the KEMB.txt,Birimian Supergroup,"42,8","2. Geology setting 
2.1 Regional geology and tectonics 
The West African Craton is composed of Palaeoproterozoic rocks of the Birimian Supergroup 
(Feybesse et  al.,  2006; Hein,  2010) and Tarkwa Group (Davis  et  al.,  1994)  as  well as  calc-
alkaline plutons which include tonalite-trondjhemite-granodiorite and diorite intrusions which 
intrude the Palaeoproterozoic stratigraphy (Pons et al., 1995; Naba et al., 2004 Hein, 2010). The Birimian Supergroup is dominated by metamorphosed sedimentary, volcano-sedimentary 
and  volcanic  sequences. The  meta-volcanic  sequences  in  the  Goren  greenstone  belt  and 
Boromo greenstone belt are at dated at 2238 ± 5 Ma and 2171 ± 7 Ma respectively (Castaing 
et  al.,  2003)  based  on  Pb-Pb  zircon  dating  from  rhyolites  within  the  belts. The 
metasedimentary  rocks  of  the  Birimian  Supergroup  comprise  mainly  metamorphosed 
volcaniclastics,  greywacke,  siltstone,  shale,  chemical  sediments  and  chert. The  younger 
Tarkwa  Group,  dated  at  2194–2132  Ma  from  U-Pb  detrital  zircons  (Davis  et  al.,  1994), 
comprises  clastic  sedimentary  rocks  derived  from  erosion  of  the  Birimian  Supergroup  of 
which it overlies unconformably (Hirdes et al., 1992 and Davis et al., 1994). || The deltaic environment determined 
from the metaclastic succession allows for the interpretation of the underlying banded iron-
formation  and amphibolite. Although definitive evidence of a  conformable contact  between 
the iron-formation and the metaclastics was not observed, the increase in metamorphic grade 
and  facing  direction  suggests  that  these  sequences  occur  lower  in  the  stratigraphy. The 
occurrence of the banded ironstone formation is typical of shallow water environments of the 
Proterozoic (Leeder, 1999). This  would have occurred distal  to  a delta setting on a shelf or 
proximal to the delta during periods of reduced sedimentation. The fine-grained sediment of 
the amphibolite would have been deposited in the prodelta in the form of shales or mudstone. The  described  protoliths  of  quartzwacke,  shale  and  possible  pebble  quartz  arenite  fit  well 
with  the  sedimentary  rocks  of  the  Birimian  Supergroup  and  in  particular  the  Oudalan-
Gorouol  greenstone belt  described by  Pons  et  al., 1995; Debat  et  al., 2003;  Tshibubudze et 
al.,  2009;  Tshibubudze  and  Hein,  submitted.",llm,GEOLOGICAL_UNIT
2011_Woolfe_The stratigraphy and metamorphic facies of the KEMB.txt,Boromo greenstone belt,8,"2. Geology setting 
2.1 Regional geology and tectonics 
The West African Craton is composed of Palaeoproterozoic rocks of the Birimian Supergroup 
(Feybesse et  al.,  2006; Hein,  2010) and Tarkwa Group (Davis  et  al.,  1994)  as  well as  calc-
alkaline plutons which include tonalite-trondjhemite-granodiorite and diorite intrusions which 
intrude the Palaeoproterozoic stratigraphy (Pons et al., 1995; Naba et al., 2004 Hein, 2010). The Birimian Supergroup is dominated by metamorphosed sedimentary, volcano-sedimentary 
and  volcanic  sequences. The  meta-volcanic  sequences  in  the  Goren  greenstone  belt  and 
Boromo greenstone belt are at dated at 2238 ± 5 Ma and 2171 ± 7 Ma respectively (Castaing 
et  al.,  2003)  based  on  Pb-Pb  zircon  dating  from  rhyolites  within  the  belts. The 
metasedimentary  rocks  of  the  Birimian  Supergroup  comprise  mainly  metamorphosed 
volcaniclastics,  greywacke,  siltstone,  shale,  chemical  sediments  and  chert. The  younger 
Tarkwa  Group,  dated  at  2194–2132  Ma  from  U-Pb  detrital  zircons  (Davis  et  al.,  1994), 
comprises  clastic  sedimentary  rocks  derived  from  erosion  of  the  Birimian  Supergroup  of 
which it overlies unconformably (Hirdes et al., 1992 and Davis et al., 1994).",llm,GEOLOGICAL_UNIT
2011_Woolfe_The stratigraphy and metamorphic facies of the KEMB.txt,Burke,49,"The intrusion of the diorite pluton. There are several granodiorite plutons that occur in 
the  surrounding  area  (Tshibubudze  and  Hein,  submitted). The  most  likely  source  of 
the pluton in KEMB could be a  younger batholith related diorite intrusions south of 
the town of Gorom Gorom. 7. The  formation  of  the  ferricrete  horizons  followed  by  the  tertiary  sands. Ferricrete 
horizons  in  the  WAC  formed  during  the  Cretaceous  and  associated  with  the 
development of in situ laterite (Brown et al., 1994; Burke and Gunnell, 2008).",rules,PLACE
2011_Woolfe_The stratigraphy and metamorphic facies of the KEMB.txt,Burkina Faso,"4,5","1. Introduction 
1.1 Preamble 
The  Kel  Enguef  metamorphic  belt  (KEMB)  is  located  in  the  low  hills  southeast  of  Gorom 
Gorom, in the northeast of Burkina Faso. It is named after the village of Kel Enguef which is 
situated  in  the  east  of  the  field  area. During  field  reconnaissance  in  2010,  the  KEMB  was 
found by the Wits research team where it presented an anomaly on the regional topographical 
and geological maps. The KEMB has not been researched in detail, thus how it fits in with 
the  surrounding  area  is  unknown. The  general  region  of  the  KEMB  has  been  mapped  by 
Castaing et al. || STUDY AREA 
a. Road to Markoye 
N 
Kel Enguef 
Kel Enguef metamorphic belt 
1 km 
b. Road to Dori 
Figure 1.1: a) Location of field area within Burkina Faso with surrounding greenstone belts and major shears 
indicated (after Tshibubudze et al., 2009). b) Satellite image of the field area in relation to Gorom Gorom. Indicated 
on the image is the location of Kel Enguef and the main roads in the area. (Google Earth) 
4","llm,rules",PLACE
2011_Woolfe_The stratigraphy and metamorphic facies of the KEMB.txt,Clarke,46,"7.3 Migmatite formation 
A  migmatite  results  from  the  partial  melting  of  a  pre-existing  rock. The  formation  of 
migmatites is generally associated with an increase in pressure and temperature as either an 
increase in  depth,  known as “static melting”, or  an increase in  differential  stress,  known as 
“dynamic melting” (Ashworth, 1985 and Sawyer, 2008). In the absence of free fluid, melting 
reactions occur at  granulite facies conditions,  typically at  temperature between 800 to  1000 
⁰C (Vernon and Clarke, 2008). However  the  occurrence  of  the  migmatite  in  the  KEMB  is  not  associated  with  a  typical 
increase in temperature and pressure along a geothermal as described above. This is due to its 
anomalous  position  between  greenschist  and  amphibolite  facies. Outcrop  suggest  the 
migmatite has  little lateral  extent and is isolated to  an area of only several  hundred metres.",rules,PLACE
2011_Woolfe_The stratigraphy and metamorphic facies of the KEMB.txt,David,46,"The  closest  occurring  migmatite  in  the  surrounding  area  is  situated  approximately  20  km 
away on the northern margin of the Dori Batholith and is interpreted as the product of aureole 
deformation  during  the  emplacement  of  the  batholith  (Tshibubudze  and  Hein,  submitted). However aureole deformation is not indicated in the KEMB as there is no intrusion in contact 
with the migmatite. Figure 7.4: Diagram indicating the melting temperature of wet granite (David 
Magrass and Brian Wells, 2010) 
45",rules,PLACE
2011_Woolfe_The stratigraphy and metamorphic facies of the KEMB.txt,Debat,8,"The craton has been subjected to several tectonic events corresponding to the deformation of 
Birimian  Supergroup. This  includes  the  SW  directed  shortening  of  the  Tangaean  Event 
(2170-2130  Ma),  SE-NW  shortening  of  the  Eburnean  Orogeny  (2130-1980  Ma)  and  the 
young Wabo-Tampelse Event. The Tangaean Event and Eburnean Orogeny were associated 
with emplacement of TTG-suite plutons and dykes (Feybesse et al., 2006; Tshibubudze et al., 
2009; Hein 2010). The tectonic events resulted in the formation of greenstone belts separated 
by  the  granitoids  (Hirdes  and  Davis,  2002). The  Eburnean  Orogeny  resulted  in  regional 
metamorphism of the Birimian Supergroup to greenschist facies and contact metamorphism 
from pluton emplacement to low - medium amphibolite facies (Pons et al., 1995; Debat et al., 
2003). 2.2 Local geology 
The  Markoye  Shear  Zone  lies  to  the  east  of  the  KEMB.",rules,PLACE
2011_Woolfe_The stratigraphy and metamorphic facies of the KEMB.txt,Dori,"47,5","Considering the KEMB and related 
pressure-temperature  conditions,  would  it  have  been  possible  to  produce  a  migmatite? The 
migmatite  is  situated  between  the  greenschist  and  amphibolite  facies. Here  temperatures 
would have been in excess of 450 ⁰C (c.f., Vernon and Clarke, 2008). The influx of fluids at 
these  temperatures  would  not  have  been  sufficient  to  induce  melting. However  there  is  the 
presence  of  several  large  plutons  in  the  surrounding  area  which  include  the  Tin  Taradat 
granodiorite-tonalite,  Dori  batholith  and  the  Granite  Adamelite  (Tshibubudze  and  Hein, 
submitted). These  could  have  been  the  source  of  high  temperature  igneous  related  fluids 
which would have infiltrated the surrounding rocks. || STUDY AREA 
a. Road to Markoye 
N 
Kel Enguef 
Kel Enguef metamorphic belt 
1 km 
b. Road to Dori 
Figure 1.1: a) Location of field area within Burkina Faso with surrounding greenstone belts and major shears 
indicated (after Tshibubudze et al., 2009). b) Satellite image of the field area in relation to Gorom Gorom. Indicated 
on the image is the location of Kel Enguef and the main roads in the area. (Google Earth) 
4","llm,rules",PLACE
2011_Woolfe_The stratigraphy and metamorphic facies of the KEMB.txt,Eburnean Orogeny,8,"The craton has been subjected to several tectonic events corresponding to the deformation of 
Birimian  Supergroup. This  includes  the  SW  directed  shortening  of  the  Tangaean  Event 
(2170-2130  Ma),  SE-NW  shortening  of  the  Eburnean  Orogeny  (2130-1980  Ma)  and  the 
young Wabo-Tampelse Event. The Tangaean Event and Eburnean Orogeny were associated 
with emplacement of TTG-suite plutons and dykes (Feybesse et al., 2006; Tshibubudze et al., 
2009; Hein 2010). The tectonic events resulted in the formation of greenstone belts separated 
by  the  granitoids  (Hirdes  and  Davis,  2002). The  Eburnean  Orogeny  resulted  in  regional 
metamorphism of the Birimian Supergroup to greenschist facies and contact metamorphism 
from pluton emplacement to low - medium amphibolite facies (Pons et al., 1995; Debat et al., 
2003). 2.2 Local geology 
The  Markoye  Shear  Zone  lies  to  the  east  of  the  KEMB.",rules,PLACE
2011_Woolfe_The stratigraphy and metamorphic facies of the KEMB.txt,Essakane gold mine,4,"The  Essakane  gold  mine  and  Tambão  manganese  deposit  are  situated  approximately 
20km ESE and 40km NNE of the field area, respectively, and similar styles of mineralisation 
may occur in the field area. 1.2 Location and physiography 
The KEMB is located in the northeast of Burkina Faso, approximately 275km to the northeast 
of Ouagadougou and east of the town of Gorom Gorom (Fig. 1.1a & 1.1b). 3",llm,GEOLOGICAL_UNIT
2011_Woolfe_The stratigraphy and metamorphic facies of the KEMB.txt,France,47,"These zones of infiltration would have 
had  to  be  concentrated  and  localised. The  rapid  increase  of  temperature  in  pre-existing  hot 
conditions could have induced partial melting and dehydration of the rock. Migmatites from 
Saint-Malo, France, with a very similar mineral assemblage of muscovite-plagioclase-quartz 
leucosome and biotite-rich melanosome, are interpreted to have formed by the breakdown of 
muscovite (Sawyer, 2008). Although the Saint-Malo migmatites have been proposed to have 
formed  in  upper  amphibolite  facies,  the  presence  of  muscovite  in  the  metamorphosed  rock 
which formed the migmatite in KEMB would have been a source for more hydrous fluid. 46",rules,PLACE
2011_Woolfe_The stratigraphy and metamorphic facies of the KEMB.txt,Goren greenstone belt,8,"2. Geology setting 
2.1 Regional geology and tectonics 
The West African Craton is composed of Palaeoproterozoic rocks of the Birimian Supergroup 
(Feybesse et  al.,  2006; Hein,  2010) and Tarkwa Group (Davis  et  al.,  1994)  as  well as  calc-
alkaline plutons which include tonalite-trondjhemite-granodiorite and diorite intrusions which 
intrude the Palaeoproterozoic stratigraphy (Pons et al., 1995; Naba et al., 2004 Hein, 2010). The Birimian Supergroup is dominated by metamorphosed sedimentary, volcano-sedimentary 
and  volcanic  sequences. The  meta-volcanic  sequences  in  the  Goren  greenstone  belt  and 
Boromo greenstone belt are at dated at 2238 ± 5 Ma and 2171 ± 7 Ma respectively (Castaing 
et  al.,  2003)  based  on  Pb-Pb  zircon  dating  from  rhyolites  within  the  belts. The 
metasedimentary  rocks  of  the  Birimian  Supergroup  comprise  mainly  metamorphosed 
volcaniclastics,  greywacke,  siltstone,  shale,  chemical  sediments  and  chert. The  younger 
Tarkwa  Group,  dated  at  2194–2132  Ma  from  U-Pb  detrital  zircons  (Davis  et  al.,  1994), 
comprises  clastic  sedimentary  rocks  derived  from  erosion  of  the  Birimian  Supergroup  of 
which it overlies unconformably (Hirdes et al., 1992 and Davis et al., 1994).",llm,GEOLOGICAL_UNIT
2011_Woolfe_The stratigraphy and metamorphic facies of the KEMB.txt,Gorom Gorom,"5,6","River  channels  trend  east  towards  a  major 
river that is located on the eastern limits of the field area. The majority of the land between 
the ridges is covered by millet fields where the underlying rock is covered by a layer of sand. Huts  are  scatted  across  the  farm  land  with  the  village  of  Kel  Enguef  situated  to  the  east 
between  the  two  ridges  of  the  field  area  (Fig. 1.1b). Dirt  roads  are  present  connecting  the 
village of Kel Enguef to the main road off to the west of the field area. Access into the field 
was either from this main road or from the north off a main road that connects Gorom Gorom 
to the village of Markoye (Fig. || STUDY AREA 
a. Road to Markoye 
N 
Kel Enguef 
Kel Enguef metamorphic belt 
1 km 
b. Road to Dori 
Figure 1.1: a) Location of field area within Burkina Faso with surrounding greenstone belts and major shears 
indicated (after Tshibubudze et al., 2009). b) Satellite image of the field area in relation to Gorom Gorom. Indicated 
on the image is the location of Kel Enguef and the main roads in the area. (Google Earth) 
4",llm,PLACE
2011_Woolfe_The stratigraphy and metamorphic facies of the KEMB.txt,Granite,47,"Considering the KEMB and related 
pressure-temperature  conditions,  would  it  have  been  possible  to  produce  a  migmatite? The 
migmatite  is  situated  between  the  greenschist  and  amphibolite  facies. Here  temperatures 
would have been in excess of 450 ⁰C (c.f., Vernon and Clarke, 2008). The influx of fluids at 
these  temperatures  would  not  have  been  sufficient  to  induce  melting. However  there  is  the 
presence  of  several  large  plutons  in  the  surrounding  area  which  include  the  Tin  Taradat 
granodiorite-tonalite,  Dori  batholith  and  the  Granite  Adamelite  (Tshibubudze  and  Hein, 
submitted). These  could  have  been  the  source  of  high  temperature  igneous  related  fluids 
which would have infiltrated the surrounding rocks.",rules,PLACE
